{
  "$schema": "https://json-schema.org/draft/2020-12/schema",
  "type": "object",
  "properties": {
    "@context": {
      "type": "string"
    },
    "@type": {
      "type": "string",
      "const": "Organization"
    },
    "@id": {
      "type": "string",
      "format": "uri"
    },
    "name": {
      "type": "string"
    },
    "description": {
      "type": "string"
    },
    "url": {
      "type": "string",
      "format": "uri"
    }
  },
  "required": [
    "@context",
    "@type",
    "@id",
    "name",
    "description",
    "url"
  ],
  "additionalProperties": false,
  "$id": "https://open-game-stack.github.io/open-game-stack-registry/schema/publishers"
}