{
  "$schema": "https://open-game-stack.github.io/open-game-stack-registry/schema/publishers",
  "@context": "https://schema.org/",
  "@type": "Organization",
  "@id": "https://open-game-stack.github.io/open-game-stack-registry/publishers/supertux-team",
  "name": "SuperTux Team",
  "description": "Open-source team developing SuperTux, a classic 2D side-scrolling platformer.",
  "url": "https://github.com/SuperTux"
}